Fornecedor;CPF/CNPJ;Data;Tipo Despesa;Valor R$;Forma de Pagamento;Beneficiário/contratante;
Comitê Financeiro Único;12.191.570/0001-95;30/09/2010;Baixa de Recursos Estimáveis em Dinheiro;R$ 3.052,80;Estimado;Comitê Financeiro Único - PMDB -  / 27027 - SEZAR DE SOUZA NAZARIO - BA - Deputado Estadual;
Comitê Financeiro Único;12.173.503/0001-48;19/08/2010;Baixa de Recursos Estimáveis em Dinheiro;R$ 204,00;Estimado;Comitê Financeiro Único - PMDB -  / 27027 - SEZAR DE SOUZA NAZARIO - BA - Deputado Estadual;
EDILENE CARNEIRO SILVA;792.595.965-72;17/08/2010;       Publicidade por carros de som;R$ 1.000,00;Cheque; -  -  / 27027 - SEZAR DE SOUZA NAZARIO - BA - Deputado Estadual;
EDNALDO ALVES DE OLIVEIRA ALMEIDA;916.211.275-91;17/08/2010;       Publicidade por carros de som;R$ 1.250,00;Cheque; -  -  / 27027 - SEZAR DE SOUZA NAZARIO - BA - Deputado Estadual;
MAXIMO DAVID VIVAS SANTIAGO - ME;10.275.206/0001-88;24/08/2010;       Publicidade por materiais impressos;R$ 1.750,00;Cheque; -  -  / 27027 - SEZAR DE SOUZA NAZARIO - BA - Deputado Estadual;
RUBEM DOS SANTOS SANTANA;924.255.935-00;20/08/2010;Baixa de Recursos Estimáveis em Dinheiro;R$ 400,00;Estimado; -  -  / 27027 - SEZAR DE SOUZA NAZARIO - BA - Deputado Estadual;
