Fornecedor;CPF/CNPJ;Data;Tipo Despesa;Valor R$;Forma de Pagamento;Beneficiário/contratante;
CARGA E RECARGA COMERCIO ESERVIÇOS LTDA- ME;04.807.843/0001-55;21/09/2010;       Serviços prestados por terceiros;R$ 70,00;Cheque; -  -  / 40610 - LUCIA MARIA FONTES PEREIRA - BA - Deputado Estadual;
CORREIOS;34.028.316/2649-41;25/09/2010;       Despesas postais;R$ 437,00;Cheque; -  -  / 40610 - LUCIA MARIA FONTES PEREIRA - BA - Deputado Estadual;
CORREIOS;34.028.316/2649-41;21/09/2010;       Despesas postais;R$ 280,00;Cheque; -  -  / 40610 - LUCIA MARIA FONTES PEREIRA - BA - Deputado Estadual;
EMPRESA EDITORA ATARDE S.A;15.111.297/0001-30;21/09/2010;       Publicidade por jornais e revistas;R$ 455,00;Cheque; -  -  / 40610 - LUCIA MARIA FONTES PEREIRA - BA - Deputado Estadual;
WELTON SIDINEI MENEZES DA SILVA;05.812.437/0001-43;28/09/2010;       Publicidade por placas, estandartes e faixas;R$ 800,00;Cheque; -  -  / 40610 - LUCIA MARIA FONTES PEREIRA - BA - Deputado Estadual;
WELTON SIDINEI MENEZES DA SILVA;05.812.437/0001-43;03/11/2010;       Publicidade por materiais impressos;R$ 57,00;Cheque; -  -  / 40610 - LUCIA MARIA FONTES PEREIRA - BA - Deputado Estadual;
