Fornecedor;CPF/CNPJ;Data;Tipo Despesa;Valor R$;Forma de Pagamento;Beneficiário/contratante;
GERALDO LUIZ DO ROSARIO LEITE;108.962.875-72;02/10/2010;Baixa de Recursos Estimáveis em Dinheiro;R$ 500,00;Estimado; -  -  / 43777 - GERALDO LUIZ DO ROSARIO LEITE - BA - Deputado Estadual;
GRAFICA SILVA CALDAS;07.993.072/0001-26;23/07/2010;       Publicidade por materiais impressos;R$ 1.560,00;Cheque; -  -  / 43777 - GERALDO LUIZ DO ROSARIO LEITE - BA - Deputado Estadual;
GRAFICA SILVA CALDAS;07.993.072/0001-26;17/07/2010;       Publicidade por materiais impressos;R$ 1.560,00;Cheque; -  -  / 43777 - GERALDO LUIZ DO ROSARIO LEITE - BA - Deputado Estadual;
MAURICIO VICENTE SILVA OLIVEIRA;07.204.066/0001-42;24/07/2010;       Publicidade por materiais impressos;R$ 150,00;Cheque; -  -  / 43777 - GERALDO LUIZ DO ROSARIO LEITE - BA - Deputado Estadual;
OLINDINA DERIVADOS DE PETROLEO LTDA;13.295.043/0001-93;14/10/2010;Baixa de Recursos Estimáveis em Dinheiro;R$ 2.267,19;Estimado; -  -  / 43777 - GERALDO LUIZ DO ROSARIO LEITE - BA - Deputado Estadual;
ROQUE BISPO DA SILVA;294.579.805-06;02/10/2010;Baixa de Recursos Estimáveis em Dinheiro;R$ 1.200,00;Estimado; -  -  / 43777 - GERALDO LUIZ DO ROSARIO LEITE - BA - Deputado Estadual;
