Fornecedor;CPF/CNPJ;Data;Tipo Despesa;Valor R$;Forma de Pagamento;Beneficiário/contratante;
ABDON MARINHO ADVOGADOS ASSOCIADOS S/C;04.622.572/0001-63;13/09/2010;       Diversas a especificar;R$ 2.000,00;Cheque; -  -  / Comitê Financeiro Único - PSL - MA;
JOÃO PAULO VELOSO FERREIRA;895.063.323-04;03/10/2010;       Cessão ou Locação de Veículos;R$ 6.000,00;Cheque; -  -  / Comitê Financeiro Único - PSL - MA;
JURACY LINHARES MELO JUNIOR;147.710.633-20;03/09/2010;       Publicidade por materiais impressos;R$ 6.000,00;Cheque; -  -  / Comitê Financeiro Único - PSL - MA;
MARIO CELSO REIS DE ALMEIDA;044.860.563-53;03/10/2010;       Cessão ou Locação de Veículos;R$ 4.500,00;Cheque; -  -  / Comitê Financeiro Único - PSL - MA;
MARIO CELSO REIS DE ALMEIDA;044.860.563-53;03/10/2010;       Cessão ou Locação de Veículos;R$ 4.500,00;Cheque; -  -  / Comitê Financeiro Único - PSL - MA;
ROSEANA SARNEY MURAD;12.171.364/0001-13;01/08/2010;Baixa de Recursos Estimáveis em Dinheiro;R$ 28.204,00;Estimado;15 -  - PMDB -  - Governador / Comitê Financeiro Único - PSL - MA;
