Doador;CPF/CNPJ;Data;Nº Recibo Eleitoral;Valor R$;Espécie do Recurso;Nome do Candidato;Número do Candidato;Candidatura;Partido;UF;
ARTDERM RIO FARMÁCIA DE MANIPULAÇÃO LTDA.;00.883.555/0001-29;29/07/2010;44000027901;R$ 300,00;Depósito em espécie;MARCELO DOS SANTOS MARQUES;44012;Deputado Estadual;PRP;RJ;
Comitê Financeiro Único;12.205.254/0001-25;25/10/2010;44000027908;R$ 1.000,00;Estimado;MARCELO DOS SANTOS MARQUES;44012;Deputado Estadual;PRP;RJ;
ELEIÇÃO 2010 NELSON ROBERTO BORNIER DE OLIVEIRA DEPUTADO FEDERAL;12.171.022/0001-01;01/08/2010;44000027903;R$ 4.250,00;Estimado;MARCELO DOS SANTOS MARQUES;44012;Deputado Estadual;PRP;RJ;
ELEMENTO BASE FARMÁCIA DE MANIPULAÇÃO LTDA.-ME;00.090.709/0001-25;09/08/2010;44000027904;R$ 360,00;Cheque;MARCELO DOS SANTOS MARQUES;44012;Deputado Estadual;PRP;RJ;
ESTER DE ABREU S. PEREIRA CONFECÇÃO E BORDADOS;08.627.850/0001-26;04/09/2010;44000027905;R$ 290,00;Estimado;MARCELO DOS SANTOS MARQUES;44012;Deputado Estadual;PRP;RJ;
