Fornecedor;CPF/CNPJ;Data;Tipo Despesa;Valor R$;Forma de Pagamento;Beneficiário/contratante;
CARLOS ALBERTO RICHA;12.190.887/0001-07;21/09/2010;Baixa de Recursos Estimáveis em Dinheiro;R$ 500,00;Estimado;45 -  - PSDB -  - Governador / 31333 - ANTONIO FONSECA DE OLIVEIRA - PR - Deputado Estadual;
CARLOS ALBERTO RICHA;12.190.887/0001-07;11/08/2010;Baixa de Recursos Estimáveis em Dinheiro;R$ 630,00;Estimado;45 -  - PSDB -  - Governador / 31333 - ANTONIO FONSECA DE OLIVEIRA - PR - Deputado Estadual;
DIGICODE COMUNICAÇÃO VISUAL LTDA;08.921.630/0001-00;21/09/2010;       Publicidade por materiais impressos;R$ 160,00;Transferência eletrônica; -  -  / 31333 - ANTONIO FONSECA DE OLIVEIRA - PR - Deputado Estadual;
LEOVIR DE OLIVEIRA;848.655.639-20;21/09/2010;Baixa de Recursos Estimáveis em Dinheiro;R$ 309,00;Estimado; -  -  / 31333 - ANTONIO FONSECA DE OLIVEIRA - PR - Deputado Estadual;
RICARDO JOSE MAGALHAES BARROS;12.190.665/0001-94;21/09/2010;Baixa de Recursos Estimáveis em Dinheiro;R$ 450,00;Estimado;111 -  - PP -  - Senador / 31333 - ANTONIO FONSECA DE OLIVEIRA - PR - Deputado Estadual;
