Fornecedor;CPF/CNPJ;Data;Tipo Despesa;Valor R$;Forma de Pagamento;Beneficiário/contratante;
CASA MARCENEIRO LTDA;75.135.012/0001-22;31/08/2010;       Publicidade por placas, estandartes e faixas;R$ 175,00;Cheque; -  -  / 1240 - LUIZA IZABEL SCHEFFER - PR - Deputado Federal;
Comitê Financeiro Único;12.205.238/0001-32;01/10/2010;Baixa de Recursos Estimáveis em Dinheiro;R$ 650,00;Estimado;Comitê Financeiro Único - PDT -  / 1240 - LUIZA IZABEL SCHEFFER - PR - Deputado Federal;
Comitê Financeiro Único;12.205.238/0001-32;01/10/2010;Baixa de Recursos Estimáveis em Dinheiro;R$ 15.059,02;Estimado;Comitê Financeiro Único - PDT -  / 1240 - LUIZA IZABEL SCHEFFER - PR - Deputado Federal;
EDITORA GRÁFICA NOSSA SENHORA APARECIDA LTDA;77.624.922/0001-02;14/09/2010;       Publicidade por jornais e revistas;R$ 300,00;Cheque; -  -  / 1240 - LUIZA IZABEL SCHEFFER - PR - Deputado Federal;
OSCAR MARCELO GANA;10.673.088/0001-66;27/09/2010;       Publicidade por materiais impressos;R$ 1.280,00;Cheque; -  -  / 1240 - LUIZA IZABEL SCHEFFER - PR - Deputado Federal;
PLAC COMERCIO DE PLASTICOS LTDA;03.070.093/0001-19;01/09/2010;       Publicidade por placas, estandartes e faixas;R$ 34,00;Cheque; -  -  / 1240 - LUIZA IZABEL SCHEFFER - PR - Deputado Federal;
