Fornecedor;CPF/CNPJ;Data;Tipo Despesa;Valor R$;Forma de Pagamento;Beneficiário/contratante;
ALESSANDRA DOS SANTOS;854.140.500-15;30/09/2010;       Despesas com pessoal;R$ 1.250,00;Cheque; -  -  / 11577 - JOSE ANTONIO DA SILVA - RS - Deputado Estadual;
JAMPIERRE DOMINGUES DA SILVA;019.025.690-75;30/09/2010;       Despesas com pessoal;R$ 1.250,00;Cheque; -  -  / 11577 - JOSE ANTONIO DA SILVA - RS - Deputado Estadual;
OSCAR DO CANTO;024.301.430-97;30/09/2010;       Despesas com pessoal;R$ 1.250,00;Cheque; -  -  / 11577 - JOSE ANTONIO DA SILVA - RS - Deputado Estadual;
RGB SOLUÇÕES GRAFICAS LTDA;08.910.080/0001-24;15/07/2010;       Publicidade por materiais impressos;R$ 1.548,00;Cheque; -  -  / 11577 - JOSE ANTONIO DA SILVA - RS - Deputado Estadual;
VANESSA DOS SANTOS DA SILVA;025.497.480-50;30/09/2010;       Despesas com pessoal;R$ 1.250,00;Cheque; -  -  / 11577 - JOSE ANTONIO DA SILVA - RS - Deputado Estadual;
YEDA RORATO CRUSIUS;12.172.247/0001-74;01/10/2010;Baixa de Recursos Estimáveis em Dinheiro;R$ 9.000,00;Estimado;45 -  - PSDB -  - Governador / 11577 - JOSE ANTONIO DA SILVA - RS - Deputado Estadual;
