Fornecedor;CPF/CNPJ;Data;Tipo Despesa;Valor R$;Forma de Pagamento;Beneficiário/contratante;
CLAUDIOMIRO DANIELI;986.575.509-20;21/07/2010;       Cessão ou Locação de Veículos;R$ 200,00;Cheque; -  -  / 40999 - MARTA DE SOUZA - RS - Deputado Estadual;
PAULO SERGIO ARAUJO DA SILVA;519.633.450-53;29/09/2010;       Serviços prestados por terceiros;R$ 200,00;Cheque; -  -  / 40999 - MARTA DE SOUZA - RS - Deputado Estadual;
POSTAL MKT INFORMATICA LTDA;94.012.127/0001-74;16/09/2010;       Publicidade por materiais impressos;R$ 100,00;Cheque; -  -  / 40999 - MARTA DE SOUZA - RS - Deputado Estadual;
ROSIMERI LUISA GIUSTI;143.839.258-39;29/09/2010;       Serviços prestados por terceiros;R$ 50,00;Cheque; -  -  / 40999 - MARTA DE SOUZA - RS - Deputado Estadual;
SAULINA MARQUES DE SOUZA;253.562.910-00;29/09/2010;       Serviços prestados por terceiros;R$ 150,00;Cheque; -  -  / 40999 - MARTA DE SOUZA - RS - Deputado Estadual;
