Doador;CPF/CNPJ;Data;Nº Recibo Eleitoral;Valor R$;Espécie do Recurso;Tipo do Comitê;Partido;UF;
ALVORADA CARTÕES, CREDITO, FINANCIAMENTO, E INVESTIMENTO S.A;74.552.142/0001-06;27/07/2010;33000002552;R$ 100.000,00;Depósito em espécie;Comitê Financeiro Único;PMN;GO;
ALVORADA CARTÕES, CREDITO, FINANCIAMENTO, E INVESTIMENTO S.A;74.552.142/0001-06;23/08/2010;33000002554;R$ 100.000,00;Depósito em espécie;Comitê Financeiro Único;PMN;GO;
CORAL ADM E SERVICOS LTDA;01.092.071/0001-24;23/09/2010;33000002555;R$ 50.000,00;Transferência eletrônica;Comitê Financeiro Único;PMN;GO;
CORAL ADM E SERVICOS LTDA;01.092.071/0001-24;21/09/2010;33000002557;R$ 150.000,00;Transferência eletrônica;Comitê Financeiro Único;PMN;GO;
LIDERENÇA CAPITALIZAÇÃO SOCIEDADE ANONIMA;60.853.264/0001-10;27/07/2010;33000002551;R$ 200.000,00;Transferência eletrônica;Comitê Financeiro Único;PMN;GO;
PEDRO PEREIRA DE FREITAS;002.438.099-72;14/09/2010;33000002556;R$ 100.000,00;Transferência eletrônica;Comitê Financeiro Único;PMN;GO;
SOL BRASCAR VEICULOS LTDA;05.599.587/0001-10;01/11/2010;33000002560;R$ 5.415,22;Cheque;Comitê Financeiro Único;PMN;GO;
