Fornecedor;CPF/CNPJ;Data;Tipo Despesa;Valor R$;Forma de Pagamento;Beneficiário/contratante;
EVERALDO PANTOJA DA COSTA;918.853.102-34;01/08/2010;       Locação/cessão de bens móveis;R$ 976,00;Não informado; -  -  / 1230 - EMILIANO QUARESMA DOS SANTOS - PA - Deputado Federal;
RAIMUNDO DA CONCEIÇÃO AGUIAR;108.588.572-00;25/08/2010;Baixa de Recursos Estimáveis em Dinheiro;R$ 1.000,00;Estimado; -  -  / 1230 - EMILIANO QUARESMA DOS SANTOS - PA - Deputado Federal;
SILVIO SIQUEIRA PINHEIRO;329.733.062-72;01/09/2010;Baixa de Recursos Estimáveis em Dinheiro;R$ 600,00;Estimado; -  -  / 1230 - EMILIANO QUARESMA DOS SANTOS - PA - Deputado Federal;
SILVIO SIQUEIRA PINHEIRO;329.733.062-72;01/09/2010;Baixa de Recursos Estimáveis em Dinheiro;R$ 300,00;Estimado; -  -  / 1230 - EMILIANO QUARESMA DOS SANTOS - PA - Deputado Federal;
;;20/09/2010;       Encargos financeiros e taxas bancárias;R$ 12,00;Débito em conta; -  -  / 1230 - EMILIANO QUARESMA DOS SANTOS - PA - Deputado Federal;
;;20/09/2010;       Encargos financeiros e taxas bancárias;R$ 12,00;Débito em conta; -  -  / 1230 - EMILIANO QUARESMA DOS SANTOS - PA - Deputado Federal;
