Doador;CPF/CNPJ;Data;Nº Recibo Eleitoral;Valor R$;Espécie do Recurso;Nome do Candidato;Número do Candidato;Candidatura;Partido;UF;
ELEIÇÃO2010 ANA JULIA DE VASCONCELOS CAREPA GOVERNADORA;12.171.430/0001-55;28/09/2010;20000471005;R$ 720,00;Estimado;JOEL PANTOJA CARNEIRO;20107;Deputado Estadual;PSC;PA;
ELEIÇÃO2010 ANA JULIA DE VASCONCELOS CAREPA GOVERNADORA;12.171.430/0001-55;28/09/2010;20000471004;R$ 1.750,00;Estimado;JOEL PANTOJA CARNEIRO;20107;Deputado Estadual;PSC;PA;
ELEIÇÃO2010 JOSE DA CRUZ MARINHO DEPUTADO FEDERAL;12.170.040/0001-60;20/08/2010;20000471001;R$ 240,00;Estimado;JOEL PANTOJA CARNEIRO;20107;Deputado Estadual;PSC;PA;
ELEIÇÃO2010 PAULO ROBERTO  GALVÃO DA ROCHA SENADOR;12.168.406/0001-67;23/09/2010;20000471003;R$ 260,00;Estimado;JOEL PANTOJA CARNEIRO;20107;Deputado Estadual;PSC;PA;
ELEIÇÃO2010 PAULO ROBERTO GALVÃO DA ROCHA SENADOR;12.168.406/0001-67;31/08/2010;20000471002;R$ 440,00;Estimado;JOEL PANTOJA CARNEIRO;20107;Deputado Estadual;PSC;PA;
