Fornecedor;CPF/CNPJ;Data;Tipo Despesa;Valor R$;Forma de Pagamento;Beneficiário/contratante;
ANTONIO VIEIRA DE MIRANDA;170.173.638-17;13/09/2010;       Publicidade por carros de som;R$ 600,00;Cheque; -  -  / 43210 - ANDRE LUIS PORTELA DACIER LOBATO - PA - Deputado Estadual;
ANTONIO VIEIRA DE MIRANDA;170.173.638-17;03/09/2010;       Publicidade por carros de som;R$ 600,00;Cheque; -  -  / 43210 - ANDRE LUIS PORTELA DACIER LOBATO - PA - Deputado Estadual;
DELTA PUBLICIDADE S/A;04.929.683/0001-17;01/10/2010;Baixa de Recursos Estimáveis em Dinheiro;R$ 10.667,20;Estimado; -  -  / 43210 - ANDRE LUIS PORTELA DACIER LOBATO - PA - Deputado Estadual;
ELEICAO 2010 ANDRE LUIS PORTELA DACIER LOBATO DEPUTADO ESTADUAL;143.684.392-87;05/09/2010;Baixa de Recursos Estimáveis em Dinheiro;R$ 5.000,00;Estimado; -  -  / 43210 - ANDRE LUIS PORTELA DACIER LOBATO - PA - Deputado Estadual;
ÉLIDA CRISTINA SILVA BRAS;619.533.692-00;05/09/2010;Baixa de Recursos Estimáveis em Dinheiro;R$ 5.000,00;Estimado; -  -  / 43210 - ANDRE LUIS PORTELA DACIER LOBATO - PA - Deputado Estadual;
IMPORTADORA BRASILEIRA LTDA;34.938.571/0002-74;13/09/2010;       Publicidade por placas, estandartes e faixas;R$ 796,00;Cheque; -  -  / 43210 - ANDRE LUIS PORTELA DACIER LOBATO - PA - Deputado Estadual;
IMPORTADORA GISLENE LTDA;00.894.625/0001-44;23/08/2010;       Publicidade por placas, estandartes e faixas;R$ 1.000,00;Cheque; -  -  / 43210 - ANDRE LUIS PORTELA DACIER LOBATO - PA - Deputado Estadual;
MARCELO ALVES RODRIGUES;399.789.232-68;05/08/2010;       Publicidade por materiais impressos;R$ 5.900,00;Cheque; -  -  / 43210 - ANDRE LUIS PORTELA DACIER LOBATO - PA - Deputado Estadual;
