Fornecedor;CPF/CNPJ;Data;Tipo Despesa;Valor R$;Forma de Pagamento;Beneficiário/contratante;
Comitê Financeiro Único;12.206.664/0001-90;29/09/2010;Baixa de Recursos Estimáveis em Dinheiro;R$ 392,00;Estimado;Comitê Financeiro Único - PSB -  / 40007 - ANTONIO DA SILVA DE SOUZA - AC - Deputado Estadual;
Comitê Financeiro Único;12.206.664/0001-90;23/09/2010;Baixa de Recursos Estimáveis em Dinheiro;R$ 657,72;Estimado;Comitê Financeiro Único - PSB -  / 40007 - ANTONIO DA SILVA DE SOUZA - AC - Deputado Estadual;
Comitê Financeiro Único;12.206.664/0001-90;01/09/2010;Baixa de Recursos Estimáveis em Dinheiro;R$ 392,00;Estimado;Comitê Financeiro Único - PSB -  / 40007 - ANTONIO DA SILVA DE SOUZA - AC - Deputado Estadual;
JOSÉ GARCIA DE MEDEIROS;005.707.962-53;03/08/2010;       Cessão ou Locação de Veículos;R$ 2.000,00;Cheque; -  -  / 40007 - ANTONIO DA SILVA DE SOUZA - AC - Deputado Estadual;
MARIA JOSÉ DE MELO ARAÚJO;390.942.272-15;03/08/2010;       Locação/cessão de bens imóveis;R$ 1.000,00;Cheque; -  -  / 40007 - ANTONIO DA SILVA DE SOUZA - AC - Deputado Estadual;
