Fornecedor;CPF/CNPJ;Data;Tipo Despesa;Valor R$;Forma de Pagamento;Beneficiário/contratante;
Diretório Estadual/Distrital;04.160.131/0001-97;30/09/2010;Baixa de Recursos Estimáveis em Dinheiro;R$ 2.100,00;Estimado;Direção Estadual/Distrital - PMDB -  / 1544 - NAAHBILA MOREIRA DOS SANTOS - AM - Deputado Federal;
Diretório Estadual/Distrital;04.160.131/0001-97;13/08/2010;Baixa de Recursos Estimáveis em Dinheiro;R$ 300,00;Estimado;Direção Estadual/Distrital - PMDB -  / 1544 - NAAHBILA MOREIRA DOS SANTOS - AM - Deputado Federal;
EDITORA ANA CASSIA LTDA;04.816.658/0001-27;30/09/2010;       Publicidade por materiais impressos;R$ 4.830,00;Cheque; -  -  / 1544 - NAAHBILA MOREIRA DOS SANTOS - AM - Deputado Federal;
;;22/10/2010;       Encargos financeiros e taxas bancárias;R$ 19,50;Débito em conta; -  -  / 1544 - NAAHBILA MOREIRA DOS SANTOS - AM - Deputado Federal;
;;26/10/2010;       Encargos financeiros e taxas bancárias;R$ 2,90;Débito em conta; -  -  / 1544 - NAAHBILA MOREIRA DOS SANTOS - AM - Deputado Federal;
