Fornecedor;CPF/CNPJ;Data;Tipo Despesa;Valor R$;Forma de Pagamento;Beneficiário/contratante;
Diretório Estadual/Distrital;04.160.131/0001-97;30/09/2010;Baixa de Recursos Estimáveis em Dinheiro;R$ 200,00;Estimado;Direção Estadual/Distrital - PMDB -  / 15444 - NAIBIA MOREIRA DOS SANTOS - AM - Deputado Estadual;
Diretório Estadual/Distrital;04.160.131/0001-97;13/08/2010;Baixa de Recursos Estimáveis em Dinheiro;R$ 300,00;Estimado;Direção Estadual/Distrital - PMDB -  / 15444 - NAIBIA MOREIRA DOS SANTOS - AM - Deputado Estadual;
EDITORA ANA CASSIA LTDA;04.816.658/0001-27;30/09/2010;       Publicidade por materiais impressos;R$ 400,00;Cheque; -  -  / 15444 - NAIBIA MOREIRA DOS SANTOS - AM - Deputado Estadual;
;;04/11/2010;       Encargos financeiros e taxas bancárias;R$ 0,13;Débito em conta; -  -  / 15444 - NAIBIA MOREIRA DOS SANTOS - AM - Deputado Estadual;
;;15/10/2010;       Encargos financeiros e taxas bancárias;R$ 2,90;Débito em conta; -  -  / 15444 - NAIBIA MOREIRA DOS SANTOS - AM - Deputado Estadual;
