Fornecedor;CPF/CNPJ;Data;Tipo Despesa;Valor R$;Forma de Pagamento;Beneficiário/contratante;
COUTO COLOR COPIADORA E GRÁFICA LTDA;10.141.688/0001-83;12/08/2010;       Publicidade por materiais impressos;R$ 1.700,00;Cheque; -  -  / 50148 - AVANIR CARVALHO PONTES - RJ - Deputado Estadual;
GENILDO DA SILVA OLIVEIRA;021.079.847-51;04/08/2010;       Publicidade por materiais impressos;R$ 670,00;Cheque; -  -  / 50148 - AVANIR CARVALHO PONTES - RJ - Deputado Estadual;
GENILDO DA SILVA OLIVEIRA;021.079.847-51;20/08/2010;       Publicidade por materiais impressos;R$ 5.390,00;Cheque; -  -  / 50148 - AVANIR CARVALHO PONTES - RJ - Deputado Estadual;
GILDA LUSIA NOGUEIRA;737.190.137-15;27/08/2010;       Despesas com pessoal;R$ 229,65;Cheque; -  -  / 50148 - AVANIR CARVALHO PONTES - RJ - Deputado Estadual;
;;10/08/2010;       Encargos financeiros e taxas bancárias;R$ 0,35;Débito em conta; -  -  / 50148 - AVANIR CARVALHO PONTES - RJ - Deputado Estadual;
