Fornecedor;CPF/CNPJ;Data;Tipo Despesa;Valor R$;Forma de Pagamento;Beneficiário/contratante;
ILHA NOTÍCIAS EDITORA JORNALÍSTICA LTDA.;28.702.165/0001-24;01/10/2010;Baixa de Recursos Estimáveis em Dinheiro;R$ 560,00;Estimado; -  -  / 4357 - RAIMUNDO NONATO DE SOUSA BERNARDO - RJ - Deputado Federal;
JOSÉ ACÁCIO;676.586.444-04;04/08/2010;       Despesas com transporte ou deslocamento;R$ 42,80;Cheque; -  -  / 4357 - RAIMUNDO NONATO DE SOUSA BERNARDO - RJ - Deputado Federal;
MYTRA GRAFICA E EDITORA LTDA;28.916.104/0001-60;27/08/2010;       Publicidade por materiais impressos;R$ 600,00;Cheque; -  -  / 4357 - RAIMUNDO NONATO DE SOUSA BERNARDO - RJ - Deputado Federal;
MYTRA GRAFICA E EDITORA LTDA;28.916.104/0001-60;02/09/2010;       Publicidade por materiais impressos;R$ 400,00;Cheque; -  -  / 4357 - RAIMUNDO NONATO DE SOUSA BERNARDO - RJ - Deputado Federal;
NILO PEÇANHA TÁXI;04.568.902/0001-80;26/08/2010;       Despesas com transporte ou deslocamento;R$ 31,80;Cheque; -  -  / 4357 - RAIMUNDO NONATO DE SOUSA BERNARDO - RJ - Deputado Federal;
