Fornecedor;CPF/CNPJ;Data;Tipo Despesa;Valor R$;Forma de Pagamento;Beneficiário/contratante;
A. AHMED EMPRESA JORNALISTICA E EDITORA LTDA.;00.184.159/0001-03;06/09/2010;       Publicidade por jornais e revistas;R$ 1.000,00;Cheque; -  -  / 17128 - CLAUDINEIA LAGE - RJ - Deputado Estadual;
ALINE ARTE PUBLICIDADE LTDA-ME;10.212.846/0001-49;18/09/2010;       Publicidade por placas, estandartes e faixas;R$ 385,00;Cheque; -  -  / 17128 - CLAUDINEIA LAGE - RJ - Deputado Estadual;
ARTECINE PRODUÇÕES E PROPAGANDA;07.904.181/0001-20;16/09/2010;       Publicidade por placas, estandartes e faixas;R$ 170,00;Cheque; -  -  / 17128 - CLAUDINEIA LAGE - RJ - Deputado Estadual;
Comitê Financeiro Único;12.181.923/0001-76;16/08/2010;Baixa de Recursos Estimáveis em Dinheiro;R$ 300,00;Estimado;Comitê Financeiro Único - PMDB -  / 17128 - CLAUDINEIA LAGE - RJ - Deputado Estadual;
ELEIÇÃO 2010 - JORGE SAYED PICCIANI;12.176.626/0001-32;31/08/2010;Baixa de Recursos Estimáveis em Dinheiro;R$ 17,00;Estimado;155 -  - PMDB -  - Senador / 17128 - CLAUDINEIA LAGE - RJ - Deputado Estadual;
ETC - EMP. BRAS. DE CORREIOS E TELEGRAFOS;34.028.316/0046-05;28/09/2010;       Despesas postais;R$ 180,84;Cheque; -  -  / 17128 - CLAUDINEIA LAGE - RJ - Deputado Estadual;
PAPEL DA MUDA BAZAR E PAPELARIA LTDA.;08.247.305/0001-04;15/09/2010;       Publicidade por materiais impressos;R$ 250,00;Cheque; -  -  / 17128 - CLAUDINEIA LAGE - RJ - Deputado Estadual;
PAPEL DA MUDA BAZAR E PAPELARIA LTDA.;08.247.305/0001-04;24/09/2010;       Publicidade por materiais impressos;R$ 1.000,00;Cheque; -  -  / 17128 - CLAUDINEIA LAGE - RJ - Deputado Estadual;
PRIMAGEM COMUNICAÇÃO VISUAL LTDA.;08.926.574/0001-05;07/08/2010;       Publicidade por materiais impressos;R$ 120,00;Cheque; -  -  / 17128 - CLAUDINEIA LAGE - RJ - Deputado Estadual;
