Doador;CPF/CNPJ;Data;Nº Recibo Eleitoral;Valor R$;Espécie do Recurso;Nome do Candidato;Número do Candidato;Candidatura;Partido;UF;
FENANDA BEIRAL DA SILVA OLIVEIRA IMPRESSÃO DIGITAL - ME;10.567.437/0001-65;15/09/2010;;R$ 645,00;Estimado;NOE DA SILVA VARGAS;43052;Deputado Estadual;PV;RJ;
JOSE GERALDO DEGLI ESPOSTI DA SILVA;005.090.127-36;15/09/2010;;R$ 250,00;Estimado;NOE DA SILVA VARGAS;43052;Deputado Estadual;PV;RJ;
NOE DA SILVA VARGAS;087.113.727-53;18/10/2010;;R$ 200,00;Depósito em espécie;NOE DA SILVA VARGAS;43052;Deputado Estadual;PV;RJ;
NOE DA SILVA VARGAS;087.113.727-53;01/11/2010;;R$ 100,00;Depósito em espécie;NOE DA SILVA VARGAS;43052;Deputado Estadual;PV;RJ;
WALTAIR DE JESUS CARVALHO - ME;32.057.200/0001-77;20/08/2010;;R$ 404,50;Estimado;NOE DA SILVA VARGAS;43052;Deputado Estadual;PV;RJ;
