Fornecedor;CPF/CNPJ;Data;Tipo Despesa;Valor R$;Forma de Pagamento;Beneficiário/contratante;
ANTONIO MARCOS DE OLIVEIRA SEPULVEDA;005.866.457-21;10/08/2010;Baixa de Recursos Estimáveis em Dinheiro;R$ 70,00;Estimado; -  -  / 7093 - GILBERTO DE OLIVEIRA SEPULVEDA - RJ - Deputado Federal;
ANTONIO MARCOS DE OLIVEIRA SEPULVEDA;005.866.457-21;15/09/2010;Baixa de Recursos Estimáveis em Dinheiro;R$ 60,00;Estimado; -  -  / 7093 - GILBERTO DE OLIVEIRA SEPULVEDA - RJ - Deputado Federal;
DOGITAL BROTHERS EMPREENDIMENTOS EM INFORMATICA LTDA;09.055.010/0001-07;06/08/2010;       Publicidade por materiais impressos;R$ 50,00;Cheque; -  -  / 7093 - GILBERTO DE OLIVEIRA SEPULVEDA - RJ - Deputado Federal;
;;28/10/2010;       Encargos financeiros e taxas bancárias;R$ 36,50;Transferência eletrônica; -  -  / 7093 - GILBERTO DE OLIVEIRA SEPULVEDA - RJ - Deputado Federal;
;;28/10/2010;       Encargos financeiros e taxas bancárias;R$ 13,50;Débito em conta; -  -  / 7093 - GILBERTO DE OLIVEIRA SEPULVEDA - RJ - Deputado Federal;
