Fornecedor;CPF/CNPJ;Data;Tipo Despesa;Valor R$;Forma de Pagamento;Beneficiário/contratante;
Comitê Financeiro Estadual/Distrital para Deputado Federal;12.200.167/0001-85;10/09/2010;Baixa de Recursos Estimáveis em Dinheiro;R$ 5.810,00;Estimado;Comitê Financeiro Distrital/Estadual para Deputado Federal - PRB -  / 1001 - ANTONIO BERNARDO DE OLIVEIRA JUNIOR - RJ - Deputado Federal;
Comitê Financeiro Único;12.200.167/0001-85;10/09/2010;Baixa de Recursos Estimáveis em Dinheiro;R$ 230,00;Estimado;Comitê Financeiro Único - PRB -  / 1001 - ANTONIO BERNARDO DE OLIVEIRA JUNIOR - RJ - Deputado Federal;
Diretório Estadual/Distrital;12.200.167/0001-85;10/08/2010;Baixa de Recursos Estimáveis em Dinheiro;R$ 4.980,00;Estimado;Direção Estadual/Distrital - PRB -  / 1001 - ANTONIO BERNARDO DE OLIVEIRA JUNIOR - RJ - Deputado Federal;
JRL TECNOLOGIA;12.119.907/0001-53;23/08/2010;       Criação e inclusão de páginas na internet;R$ 355,40;Cheque; -  -  / 1001 - ANTONIO BERNARDO DE OLIVEIRA JUNIOR - RJ - Deputado Federal;
STUDIO GRÁFICO GOOL DE PLACA LTDA;04.267.598/0001-30;10/09/2010;       Publicidade por materiais impressos;R$ 28,00;Cheque; -  -  / 1001 - ANTONIO BERNARDO DE OLIVEIRA JUNIOR - RJ - Deputado Federal;
