Fornecedor;CPF/CNPJ;Data;Tipo Despesa;Valor R$;Forma de Pagamento;Beneficiário/contratante;
A PONTUAL IMPRESSOS RAPIDOS LTDA;11.299.468/0001-45;30/09/2010;       Publicidade por materiais impressos;R$ 5.390,00;Cheque; -  -  / 1545 - RIVALDO SOARES DO NASCIMENTO - PE - Deputado Federal;
ELSON IRAKITAN MELO DE BRITO GRÁFICA;07.601.034/0001-80;13/08/2010;       Publicidade por materiais impressos;R$ 550,00;Cheque; -  -  / 1545 - RIVALDO SOARES DO NASCIMENTO - PE - Deputado Federal;
JOÃO BATISTA VIANA DA SILVA;412.759.694-53;15/09/2010;Baixa de Recursos Estimáveis em Dinheiro;R$ 1.500,00;Estimado; -  -  / 1545 - RIVALDO SOARES DO NASCIMENTO - PE - Deputado Federal;
JOSÉ SIQUEIRA JUNIOR;220.770.734-20;17/09/2010;       Publicidade por carros de som;R$ 2.000,00;Cheque; -  -  / 1545 - RIVALDO SOARES DO NASCIMENTO - PE - Deputado Federal;
RA COMERCIO E FABRICAÇÃO DE PLASTICOS LTDA;07.549.039/0001-01;22/09/2010;       Publicidade por materiais impressos;R$ 1.200,00;Cheque; -  -  / 1545 - RIVALDO SOARES DO NASCIMENTO - PE - Deputado Federal;
STAMP NORT LTDA;69.941.540/0001-76;03/09/2010;       Publicidade por materiais impressos;R$ 1.250,00;Cheque; -  -  / 1545 - RIVALDO SOARES DO NASCIMENTO - PE - Deputado Federal;
