Fornecedor;CPF/CNPJ;Data;Tipo Despesa;Valor R$;Forma de Pagamento;Beneficiário/contratante;
AUGUSTO RODRIGUES COUTINHO DE MELO;12.175.443/0001-00;01/10/2010;Baixa de Recursos Estimáveis em Dinheiro;R$ 120,00;Estimado;2555 -  - DEM -  - Deputado Federal / 25155 - INÁCIO FLORÊNCIO FILHO - PE - Deputado Estadual;
AUGUSTO RODRIGUES COUTINHO DE MELO;12.175.443/0001-00;24/09/2010;Baixa de Recursos Estimáveis em Dinheiro;R$ 700,00;Estimado;2555 -  - DEM -  - Deputado Federal / 25155 - INÁCIO FLORÊNCIO FILHO - PE - Deputado Estadual;
AUTO POSTO DUQUE DE CAXIAS LTDA;11.481.678/0001-50;21/09/2010;       Combustíveis e lubrificantes;R$ 173,01;Cheque; -  -  / 25155 - INÁCIO FLORÊNCIO FILHO - PE - Deputado Estadual;
AUTO POSTO NATAL LTDA;06.914.182/0001-92;02/10/2010;       Combustíveis e lubrificantes;R$ 260,00;Cheque; -  -  / 25155 - INÁCIO FLORÊNCIO FILHO - PE - Deputado Estadual;
ESCOLA DOM BOMSCO DE ARTES E OFÍCIOS;10.913.861/0001-14;28/09/2010;       Publicidade por materiais impressos;R$ 632,00;Cheque; -  -  / 25155 - INÁCIO FLORÊNCIO FILHO - PE - Deputado Estadual;
GERALDA VALDIVINO DA SILVA MOTA;10.667.593/0001-06;17/09/2010;       Publicidade por materiais impressos;R$ 6.900,00;Cheque; -  -  / 25155 - INÁCIO FLORÊNCIO FILHO - PE - Deputado Estadual;
JOSÉ BELO DOS SANTOS AMORIM;103.902.354-15;02/09/2010;Baixa de Recursos Estimáveis em Dinheiro;R$ 5.923,80;Estimado; -  -  / 25155 - INÁCIO FLORÊNCIO FILHO - PE - Deputado Estadual;
