Fornecedor;CPF/CNPJ;Data;Tipo Despesa;Valor R$;Forma de Pagamento;Beneficiário/contratante;
EMPRESA BRASILEIRA DE CORREIOS E TELEGRAFOS;34.028.316/0500-46;27/09/2010;       Despesas postais;R$ 10.000,00;Cheque; -  -  / 65644 - VICENTE MANOEL LEITE ANDRE GOMES - PE - Deputado Estadual;
EMPRESA BRASILEIRA DE CORREIOS E TELEGRAFOS;34.028.316/0500-46;27/09/2010;       Despesas postais;R$ 9.102,86;Cheque; -  -  / 65644 - VICENTE MANOEL LEITE ANDRE GOMES - PE - Deputado Estadual;
SEVERINO XAVIER DE SANANA;285.784.654-15;12/08/2010;       Locação/cessão de bens imóveis;R$ 5.000,00;Cheque; -  -  / 65644 - VICENTE MANOEL LEITE ANDRE GOMES - PE - Deputado Estadual;
SOCIEDADE DE TAXI AEREO WESTON LTDA;10.946.986/0002-21;02/10/2010;       Despesas com transporte ou deslocamento;R$ 3.500,00;Cheque; -  -  / 65644 - VICENTE MANOEL LEITE ANDRE GOMES - PE - Deputado Estadual;
UNISEIS COMERCIO REPRESENTAÇAO SERVIÇOS DE ENGENHARIA LTDA ME;04.041.447/0001-60;23/08/2010;       Diversas a especificar;R$ 2.000,00;Cheque; -  -  / 65644 - VICENTE MANOEL LEITE ANDRE GOMES - PE - Deputado Estadual;
;;05/10/2010;       Encargos financeiros e taxas bancárias;R$ 0,35;Débito em conta; -  -  / 65644 - VICENTE MANOEL LEITE ANDRE GOMES - PE - Deputado Estadual;
;;23/08/2010;       Encargos financeiros e taxas bancárias;R$ 5,50;Débito em conta; -  -  / 65644 - VICENTE MANOEL LEITE ANDRE GOMES - PE - Deputado Estadual;
