Fornecedor;CPF/CNPJ;Data;Tipo Despesa;Valor R$;Forma de Pagamento;Beneficiário/contratante;
ANTONIO JOSE DE SANTANA;103.605.734-87;04/08/2010;Baixa de Recursos Estimáveis em Dinheiro;R$ 700,00;Estimado; -  -  / 31123 - GLEDSON CAMARGO PIMENTEL - PE - Deputado Estadual;
CARLOS EDUARDO DA SILVA SANTOS;050.558.024-13;24/09/2010;       Serviços prestados por terceiros;R$ 720,00;Cheque; -  -  / 31123 - GLEDSON CAMARGO PIMENTEL - PE - Deputado Estadual;
OLINDA COMUNICAÇÃO VISUAL LTDA;04.918.831/0001-06;01/10/2010;       Publicidade por materiais impressos;R$ 955,00;Cheque; -  -  / 31123 - GLEDSON CAMARGO PIMENTEL - PE - Deputado Estadual;
OLINDA COMUNICAÇÃO VISUAL LTDA;04.918.831/0001-06;01/10/2010;       Publicidade por materiais impressos;R$ 900,00;Cheque; -  -  / 31123 - GLEDSON CAMARGO PIMENTEL - PE - Deputado Estadual;
SILVIO BORBA DE MORAIS;35.705.946/0001-38;24/09/2010;       Publicidade por materiais impressos;R$ 2.500,00;Cheque; -  -  / 31123 - GLEDSON CAMARGO PIMENTEL - PE - Deputado Estadual;
VALTER JOSE PIMENTEL JUNIOR;577.792.444-15;30/09/2010;Baixa de Recursos Estimáveis em Dinheiro;R$ 1.600,00;Estimado; -  -  / 31123 - GLEDSON CAMARGO PIMENTEL - PE - Deputado Estadual;
