Doador;CPF/CNPJ;Data;Nº Recibo Eleitoral;Valor R$;Espécie do Recurso;Nome do Candidato;Número do Candidato;Candidatura;Partido;UF;
ABASTECEDORA CIADI IND E COMERCIO IMPOT E EXP LTDA;02.976.575/0001-70;25/08/2010;43001584202;R$ 100,00;Estimado;JOSÉ SILVÉRIO GOMES DOMINGOS;4386;Deputado Federal;PV;SP;
ABASTECEDORA CIADI IND E COMERCIO IMPOT E EXP LTDA;02.976.575/0001-70;01/09/2010;43001584203;R$ 320,00;Estimado;JOSÉ SILVÉRIO GOMES DOMINGOS;4386;Deputado Federal;PV;SP;
FRANCISCA SANTANA BHERING;859.571.868-72;06/09/2010;43001584204;R$ 500,00;Cheque;JOSÉ SILVÉRIO GOMES DOMINGOS;4386;Deputado Federal;PV;SP;
GRAFICA E EDITORA BEDONI LTDA;61.360.699/0001-95;01/10/2010;43001584205;R$ 650,00;Estimado;JOSÉ SILVÉRIO GOMES DOMINGOS;4386;Deputado Federal;PV;SP;
RICARDO YOUNG SILVA;12.167.924/0001-66;06/08/2010;43001584201;R$ 445,50;Estimado;JOSÉ SILVÉRIO GOMES DOMINGOS;4386;Deputado Federal;PV;SP;
