Doador;CPF/CNPJ;Data;Nº Recibo Eleitoral;Valor R$;Espécie do Recurso;Nome do Candidato;Número do Candidato;Candidatura;Partido;UF;
AMPLATUR TRANSPORTES E TURISMO - ATLANTICO TRANSPORTES E TURISMO LTDA;08.380.889/0001-91;05/09/2010;15000054751;R$ 7.500,00;Estimado;ANTONIO CARLOS VASCONCELOS CALMON;15615;Deputado Estadual;PMDB;BA;
ANGELO GOMES SOUZA FILHO;964.435.535-00;05/09/2010;15000054752;R$ 800,00;Estimado;ANTONIO CARLOS VASCONCELOS CALMON;15615;Deputado Estadual;PMDB;BA;
Comitê Financeiro Único;12.191.570/0001-95;01/10/2010;15000054759;R$ 190,80;Estimado;ANTONIO CARLOS VASCONCELOS CALMON;15615;Deputado Estadual;PMDB;BA;
CSJ EMPREENDIMENTOS E SERVIÇOS LTDA;00.096.025/0001-30;10/09/2010;15000054757;R$ 12.500,00;Estimado;ANTONIO CARLOS VASCONCELOS CALMON;15615;Deputado Estadual;PMDB;BA;
ESPEDITO CARLOS REGIS DA MATA;869.888.165-34;05/09/2010;15000054753;R$ 1.000,00;Estimado;ANTONIO CARLOS VASCONCELOS CALMON;15615;Deputado Estadual;PMDB;BA;
GLADESTON BRANDÃO DE SOUZA;00.812.893/0001-70;08/09/2010;15000054756;R$ 8.750,00;Estimado;ANTONIO CARLOS VASCONCELOS CALMON;15615;Deputado Estadual;PMDB;BA;
MARVEL TRANSPORTES LOCAÇÃO E SERVIÇOS LTDA;04.753.427/0001-11;05/09/2010;15000054760;R$ 5.105,00;Estimado;ANTONIO CARLOS VASCONCELOS CALMON;15615;Deputado Estadual;PMDB;BA;
RAIMUNDO SERGIO DE AGUIAR FERRAZ JUNIOR;121.780.635-00;01/10/2010;15000054758;R$ 2.400,00;Estimado;ANTONIO CARLOS VASCONCELOS CALMON;15615;Deputado Estadual;PMDB;BA;
YAHWEH SHAMAH GRAFICA E EDITORA;06.030.587/0001-68;08/09/2010;15000054755;R$ 1.700,00;Estimado;ANTONIO CARLOS VASCONCELOS CALMON;15615;Deputado Estadual;PMDB;BA;
