Fornecedor;CPF/CNPJ;Data;Tipo Despesa;Valor R$;Forma de Pagamento;Beneficiário/contratante;
IDEAL EXPRESS COMUNICACAO VISUAL LTDA ME;10.860.119/0001-98;26/07/2010;       Publicidade por materiais impressos;R$ 2.400,00;Cheque; -  -  / 17389 - GILSON AMORIM SOBRINHO - DF - Deputado Distrital;
IDEAL EXPRESS COMUNICACAO VISUAL LTDA ME;10.860.119/0001-98;01/09/2010;       Publicidade por materiais impressos;R$ 4.200,00;Cheque; -  -  / 17389 - GILSON AMORIM SOBRINHO - DF - Deputado Distrital;
MADEREIRA ROCHA;04.768.355/0001-86;05/08/2010;       Diversas a especificar;R$ 380,00;Cheque; -  -  / 17389 - GILSON AMORIM SOBRINHO - DF - Deputado Distrital;
SOLANGE OLINDA DOS SANTOS;771.035.561-72;09/08/2010;       Locação/cessão de bens imóveis;R$ 400,00;Cheque; -  -  / 17389 - GILSON AMORIM SOBRINHO - DF - Deputado Distrital;
WELLINGTON DE ARAUJO CUNHA;869.261.521-87;29/07/2010;       Publicidade por materiais impressos;R$ 100,00;Cheque; -  -  / 17389 - GILSON AMORIM SOBRINHO - DF - Deputado Distrital;
