Fornecedor;CPF/CNPJ;Data;Tipo Despesa;Valor R$;Forma de Pagamento;Beneficiário/contratante;
ELEIÇAO JOSE TARGINO MARANHAO;12.189.345/0001-14;20/09/2010;Baixa de Recursos Estimáveis em Dinheiro;R$ 6.000,00;Estimado;15 -  - PMDB -  - Governador / 70000 - JOSE MARCOS MARINHO FALCÃO - PB - Deputado Estadual;
ELEIÇAO 2010 JOSE TARGINO MARANHAO;12.189.345/0001-14;23/09/2010;Baixa de Recursos Estimáveis em Dinheiro;R$ 523,56;Estimado;15 -  - PMDB -  - Governador / 70000 - JOSE MARCOS MARINHO FALCÃO - PB - Deputado Estadual;
ELEIÇAO 2010 JOSE WILSON SANTIAGO SENADOR;12.190.015/0001-49;30/09/2010;Baixa de Recursos Estimáveis em Dinheiro;R$ 180,00;Estimado;151 -  - PMDB -  - Senador / 70000 - JOSE MARCOS MARINHO FALCÃO - PB - Deputado Estadual;
GRAFICA E EDITORA AGENDA LTDA;00.676.136/0001-16;03/08/2010;       Publicidade por materiais impressos;R$ 1.100,00;Cheque; -  -  / 70000 - JOSE MARCOS MARINHO FALCÃO - PB - Deputado Estadual;
GRAFICA E EDITORA AGENDA LTDA;00.676.136/0001-16;22/09/2010;       Publicidade por materiais impressos;R$ 355,00;Cheque; -  -  / 70000 - JOSE MARCOS MARINHO FALCÃO - PB - Deputado Estadual;
GRAFICA E EDITORA AGENDA LTDA;00.676.136/0001-16;03/08/2010;       Publicidade por materiais impressos;R$ 1.320,00;Cheque; -  -  / 70000 - JOSE MARCOS MARINHO FALCÃO - PB - Deputado Estadual;
OZANILDA GONDIM VITAL DO REGO;12.200.007/0001-36;07/08/2010;Baixa de Recursos Estimáveis em Dinheiro;R$ 272,50;Estimado;1510 -  - PMDB -  - Deputado Federal / 70000 - JOSE MARCOS MARINHO FALCÃO - PB - Deputado Estadual;
VINICIUS MARINHO VIDAL DE NEGREIROS;007.476.564-79;01/10/2010;       Diversas a especificar;R$ 114,65;Cheque; -  -  / 70000 - JOSE MARCOS MARINHO FALCÃO - PB - Deputado Estadual;
;;08/09/2010;       Encargos financeiros e taxas bancárias;R$ 0,35;Débito em conta; -  -  / 70000 - JOSE MARCOS MARINHO FALCÃO - PB - Deputado Estadual;
