Fornecedor;CPF/CNPJ;Data;Tipo Despesa;Valor R$;Forma de Pagamento;Beneficiário/contratante;
ELONITA MAGALHAES AGOSTINO;060.814.294-82;27/09/2010;       Serviços prestados por terceiros;R$ 70,00;Cheque; -  -  / 28242 - ALBERICO FRANCISCO DO MONTE - PB - Deputado Estadual;
GERALDO ARAÚJO DE MEDEIROS;10.271.285/0001-59;23/09/2010;Baixa de Recursos Estimáveis em Dinheiro;R$ 650,00;Estimado; -  -  / 28242 - ALBERICO FRANCISCO DO MONTE - PB - Deputado Estadual;
JOSÉ TARGINO MARANHÃO;12.189.345/0001-14;23/09/2010;Baixa de Recursos Estimáveis em Dinheiro;R$ 523,56;Estimado;15 -  - PMDB -  - Governador / 28242 - ALBERICO FRANCISCO DO MONTE - PB - Deputado Estadual;
MARGARIDA OLIVEIRA MOURA CARDOSO;577.917.914-04;27/09/2010;       Serviços prestados por terceiros;R$ 70,00;Cheque; -  -  / 28242 - ALBERICO FRANCISCO DO MONTE - PB - Deputado Estadual;
;;21/09/2010;       Encargos financeiros e taxas bancárias;R$ 0,35;Débito em conta; -  -  / 28242 - ALBERICO FRANCISCO DO MONTE - PB - Deputado Estadual;
