Fornecedor;CPF/CNPJ;Data;Tipo Despesa;Valor R$;Forma de Pagamento;Beneficiário/contratante;
ELEIÇÕES 2010 JOSÉ TARGINO MARANHÃO;12.189.345/0001-14;06/09/2010;Baixa de Recursos Estimáveis em Dinheiro;R$ 150,00;Estimado;15 -  - PMDB -  - Governador / 20015 - FABIANO ARMSTRONG DANTAS - PB - Deputado Estadual;
ELEIÇÕES 2010 JOSÉ TARGINO MARANHÃO;12.189.345/0001-14;23/09/2010;Baixa de Recursos Estimáveis em Dinheiro;R$ 523,56;Estimado;15 -  - PMDB -  - Governador / 20015 - FABIANO ARMSTRONG DANTAS - PB - Deputado Estadual;
IGLY JANINE DO EGITO ALMEIDA;06.200.866/0001-22;27/09/2010;       Publicidade por materiais impressos;R$ 600,00;Transferência eletrônica; -  -  / 20015 - FABIANO ARMSTRONG DANTAS - PB - Deputado Estadual;
NEON LINE PLACAS LUMINOSAS LTDA;02.083.778/0001-37;01/09/2010;       Publicidade por materiais impressos;R$ 5.000,00;Não informado; -  -  / 20015 - FABIANO ARMSTRONG DANTAS - PB - Deputado Estadual;
;;27/09/2010;       Encargos financeiros e taxas bancárias;R$ 13,50;Débito em conta; -  -  / 20015 - FABIANO ARMSTRONG DANTAS - PB - Deputado Estadual;
;;26/08/2010;       Encargos financeiros e taxas bancárias;R$ 3,00;Débito em conta; -  -  / 20015 - FABIANO ARMSTRONG DANTAS - PB - Deputado Estadual;
