Fornecedor;CPF/CNPJ;Data;Tipo Despesa;Valor R$;Forma de Pagamento;Beneficiário/contratante;
ARTECORES COMUNICAÇÃO VISUAL LTDA;02.796.182/0001-84;20/08/2010;       Publicidade por materiais impressos;R$ 450,00;Cheque; -  -  / 23444 - MARIA JOSE DOS SANTOS - AL - Deputado Estadual;
ELEIÇÃO 2010 TEOTÔNIO BRANDÃO VILELA FILHO GOVERNADOR;12.170.978/0001-80;01/08/2010;Baixa de Recursos Estimáveis em Dinheiro;R$ 31.620,00;Estimado;45 -  - PSDB -  - Governador / 23444 - MARIA JOSE DOS SANTOS - AL - Deputado Estadual;
ELEIÇÃO 2010 TEOTÔNIO BRANDÃO VILELA FILHO GOVERNADOR;12.170.978/0001-80;28/09/2010;Baixa de Recursos Estimáveis em Dinheiro;R$ 750,00;Estimado;45 -  - PSDB -  - Governador / 23444 - MARIA JOSE DOS SANTOS - AL - Deputado Estadual;
ELEIÇÃO 2010 TEOTÔNIO BRANDÃO VILELA FILHO GOVERNADOR;12.170.978/0001-80;15/09/2010;Baixa de Recursos Estimáveis em Dinheiro;R$ 2.947,86;Estimado;45 -  - PSDB -  - Governador / 23444 - MARIA JOSE DOS SANTOS - AL - Deputado Estadual;
MIX IMPRESSOS BRINDES LTDA.;11.355.874/0001-88;29/09/2010;       Publicidade por materiais impressos;R$ 9.950,00;Cheque; -  -  / 23444 - MARIA JOSE DOS SANTOS - AL - Deputado Estadual;
QUITERIA CRISTINE DOS SANTOS;677.087.814-34;02/10/2010;       Serviços prestados por terceiros;R$ 80,00;Cheque; -  -  / 23444 - MARIA JOSE DOS SANTOS - AL - Deputado Estadual;
