Fornecedor;CPF/CNPJ;Data;Tipo Despesa;Valor R$;Forma de Pagamento;Beneficiário/contratante;
Comitê Financeiro Único;12.235.322/0001-07;22/10/2010;Baixa de Recursos Estimáveis em Dinheiro;R$ 200,00;Estimado;Comitê Financeiro Único - PSTU -  / 1666 - UBIRAJARA QUEIROZ DE OLIVEIRA - RN - Deputado Federal;
Comitê Financeiro Único;12.235.322/0001-07;10/10/2010;Baixa de Recursos Estimáveis em Dinheiro;R$ 600,00;Estimado;Comitê Financeiro Único - PSTU -  / 1666 - UBIRAJARA QUEIROZ DE OLIVEIRA - RN - Deputado Federal;
GRAFICA SUL & EDITORA LTDA;06.948.614/0001-86;18/10/2010;       Publicidade por materiais impressos;R$ 142,00;Cheque; -  -  / 1666 - UBIRAJARA QUEIROZ DE OLIVEIRA - RN - Deputado Federal;
GRAFIPEL SERVIÇOS GRAFICOS E REPROGRAFICOS LTDA;03.239.088/0001-97;28/09/2010;       Publicidade por materiais impressos;R$ 150,00;Cheque; -  -  / 1666 - UBIRAJARA QUEIROZ DE OLIVEIRA - RN - Deputado Federal;
LUCIANA LIMA DA SILVA;12.199.743/0001-11;24/09/2010;Baixa de Recursos Estimáveis em Dinheiro;R$ 45,00;Estimado;16123 -  - PSTU -  - Deputado Estadual / 1666 - UBIRAJARA QUEIROZ DE OLIVEIRA - RN - Deputado Federal;
WILSON DA SILVA BARBOSA;061.549.894-90;10/10/2010;Baixa de Recursos Estimáveis em Dinheiro;R$ 400,00;Estimado; -  -  / 1666 - UBIRAJARA QUEIROZ DE OLIVEIRA - RN - Deputado Federal;
