Fornecedor;CPF/CNPJ;Data;Tipo Despesa;Valor R$;Forma de Pagamento;Beneficiário/contratante;
ALDENIS PEREIRA SOUSA;017.234.443-32;01/09/2010;       Despesas com pessoal;R$ 3.000,00;Cheque; -  -  / 1444 - FLAUBERTH DE OLIVEIRA AMARAL - MA - Deputado Federal;
COMERCIO DE DERIVADOS DE PETROLEO LTDA;63.413.132/0001-65;12/09/2010;       Combustíveis e lubrificantes;R$ 3.000,00;Cheque; -  -  / 1444 - FLAUBERTH DE OLIVEIRA AMARAL - MA - Deputado Federal;
Comitê Financeiro Único;12.200.118/0001-42;01/08/2010;Baixa de Recursos Estimáveis em Dinheiro;R$ 641,00;Estimado;Comitê Financeiro Único - PTB -  / 1444 - FLAUBERTH DE OLIVEIRA AMARAL - MA - Deputado Federal;
M.P.C. DE OLIVEIRA ARTES GRAFICA;07.267.788/0001-46;01/09/2010;       Publicidade por materiais impressos;R$ 3.000,00;Cheque; -  -  / 1444 - FLAUBERTH DE OLIVEIRA AMARAL - MA - Deputado Federal;
RICARDO ROMULO DE JESUS SALOMAO PESSOA;760.049.373-04;13/07/2010;       Publicidade por carros de som;R$ 6.000,00;Cheque; -  -  / 1444 - FLAUBERTH DE OLIVEIRA AMARAL - MA - Deputado Federal;
THIBÉRIO HENRIQUE LIMA CORDEIRO;837.394.243-20;01/08/2010;Baixa de Recursos Estimáveis em Dinheiro;R$ 1.500,00;Estimado; -  -  / 1444 - FLAUBERTH DE OLIVEIRA AMARAL - MA - Deputado Federal;
V. PINHEIRO SOARES COMERCIO;10.733.323/0001-48;30/09/2010;       Materiais de expediente;R$ 10,00;Cheque; -  -  / 1444 - FLAUBERTH DE OLIVEIRA AMARAL - MA - Deputado Federal;
