Fornecedor;CPF/CNPJ;Data;Tipo Despesa;Valor R$;Forma de Pagamento;Beneficiário/contratante;
BELTON HERNAN DA SILVA SOUZA;780.846.012-53;24/09/2010;       Cessão ou Locação de Veículos;R$ 2.000,00;Cheque; -  -  / 44234 - ROSE LANE ALVES JARDIM - AC - Deputado Estadual;
Comitê Financeiro Único;12.205.237/0001-98;05/08/2010;Baixa de Recursos Estimáveis em Dinheiro;R$ 267,72;Estimado;Comitê Financeiro Único - PRP -  / 44234 - ROSE LANE ALVES JARDIM - AC - Deputado Estadual;
Comitê Financeiro Único;12.205.237/0001-98;20/08/2010;Baixa de Recursos Estimáveis em Dinheiro;R$ 358,80;Estimado;Comitê Financeiro Único - PRP -  / 44234 - ROSE LANE ALVES JARDIM - AC - Deputado Estadual;
Comitê Financeiro Único;12.205.237/0001-98;08/09/2010;Baixa de Recursos Estimáveis em Dinheiro;R$ 545,00;Estimado;Comitê Financeiro Único - PRP -  / 44234 - ROSE LANE ALVES JARDIM - AC - Deputado Estadual;
ROSE LANE ALVES JARDIM;666.901.616-68;09/09/2010;       Diversas a especificar;R$ 700,00;Cheque; -  -  / 44234 - ROSE LANE ALVES JARDIM - AC - Deputado Estadual;
SAMA AUTO POSTO;07.933.620/0001-22;03/10/2010;       Combustíveis e lubrificantes;R$ 100,00;Cheque; -  -  / 44234 - ROSE LANE ALVES JARDIM - AC - Deputado Estadual;
UCHOA PUBLICIDADE - CAVALCANTE & SOUSA LTDA.;14.357.263/0001-67;30/09/2010;       Publicidade por materiais impressos;R$ 3.000,00;Cheque; -  -  / 44234 - ROSE LANE ALVES JARDIM - AC - Deputado Estadual;
