Fornecedor;CPF/CNPJ;Data;Tipo Despesa;Valor R$;Forma de Pagamento;Beneficiário/contratante;
BEKO´S EMBALAGENS LTDA;07.776.060/0001-40;02/10/2010;       Materiais de expediente;R$ 10,00;Cheque; -  -  / 50014 - GILBERTO JOSÉ FELIPE - GO - Deputado Estadual;
ELIAS VAZ DE ANDRADE;12.176.800/0001-47;14/09/2010;Baixa de Recursos Estimáveis em Dinheiro;R$ 150,00;Estimado;500 -  - PSOL -  - Senador / 50014 - GILBERTO JOSÉ FELIPE - GO - Deputado Estadual;
LIBERDADE GRAFICA E EDITORA LTDA;01.843.409/0001-32;02/10/2010;       Publicidade por materiais impressos;R$ 100,00;Cheque; -  -  / 50014 - GILBERTO JOSÉ FELIPE - GO - Deputado Estadual;
LIBERDADE GRAFICA E EDITORA LTDA;01.843.409/0001-32;18/08/2010;       Publicidade por materiais impressos;R$ 107,25;Cheque; -  -  / 50014 - GILBERTO JOSÉ FELIPE - GO - Deputado Estadual;
MARTINIANO PEREIRA CAVALCANTE NETO;12.172.801/0001-13;10/08/2010;Baixa de Recursos Estimáveis em Dinheiro;R$ 146,02;Estimado;50123 -  - PSOL -  - Deputado Estadual / 50014 - GILBERTO JOSÉ FELIPE - GO - Deputado Estadual;
WASHINGTON FRAGA GUIMARAES;12.174.176/0001-49;23/08/2010;Baixa de Recursos Estimáveis em Dinheiro;R$ 80,00;Estimado;50 -  - PSOL -  - Governador / 50014 - GILBERTO JOSÉ FELIPE - GO - Deputado Estadual;
