Fornecedor;CPF/CNPJ;Data;Tipo Despesa;Valor R$;Forma de Pagamento;Beneficiário/contratante;
Comitê Financeiro Único;12.205.218/0001-61;19/07/2010;Baixa de Recursos Estimáveis em Dinheiro;R$ 10,00;Estimado;Comitê Financeiro Único - PV -  / 43457 - FILINTRO LURA DE SÁ NETO - PI - Deputado Estadual;
TERESA DOS SANTOS SOUSA BRITTO;12.172.795/0001-02;16/09/2010;Baixa de Recursos Estimáveis em Dinheiro;R$ 2.000,00;Estimado;43 -  - PV -  - Governador / 43457 - FILINTRO LURA DE SÁ NETO - PI - Deputado Estadual;
TERESA DOS SANTOS SOUSA BRITTO;12.172.795/0001-02;05/08/2010;Baixa de Recursos Estimáveis em Dinheiro;R$ 100,00;Estimado;43 -  - PV -  - Governador / 43457 - FILINTRO LURA DE SÁ NETO - PI - Deputado Estadual;
TERESA DOS SANTOS SOUSA BRITTO;12.172.795/0000-10;20/09/2010;Baixa de Recursos Estimáveis em Dinheiro;R$ 400,00;Estimado; -  -  / 43457 - FILINTRO LURA DE SÁ NETO - PI - Deputado Estadual;
VALDECY BATISTA DA COSTA;397.562.623-20;27/09/2010;       Despesas com pessoal;R$ 500,00;Cheque; -  -  / 43457 - FILINTRO LURA DE SÁ NETO - PI - Deputado Estadual;
