Fornecedor;CPF/CNPJ;Data;Tipo Despesa;Valor R$;Forma de Pagamento;Beneficiário/contratante;
BOOK COMUNICAÇÃO VISUAL - RACHAEL AZEVEDO SILVA;10.872.948/0001-90;02/10/2010;       Publicidade por materiais impressos;R$ 200,00;Não informado; -  -  / 17170 - ERNANI DE PAULA BRAGA - MG - Deputado Estadual;
Comitê Financeiro Único;12.147.821/0001-34;09/08/2010;Baixa de Recursos Estimáveis em Dinheiro;R$ 508,00;Estimado;Comitê Financeiro Único - PSL -  / 17170 - ERNANI DE PAULA BRAGA - MG - Deputado Estadual;
Comitê Financeiro Único;12.147.821/0001-34;21/09/2010;Baixa de Recursos Estimáveis em Dinheiro;R$ 45,00;Estimado;Comitê Financeiro Único - PSL -  / 17170 - ERNANI DE PAULA BRAGA - MG - Deputado Estadual;
Comitê Financeiro Único;12.147.821/0001-34;15/08/2010;Baixa de Recursos Estimáveis em Dinheiro;R$ 1.197,84;Estimado;Comitê Financeiro Único - PSL -  / 17170 - ERNANI DE PAULA BRAGA - MG - Deputado Estadual;
GRÁFICA E EDITORA PEREIRA;22.176.309/0001-70;02/10/2010;       Publicidade por materiais impressos;R$ 2.850,00;Não informado; -  -  / 17170 - ERNANI DE PAULA BRAGA - MG - Deputado Estadual;
INDUSTRIA GRAFICA CAMBUÍ LTDA;02.989.904/0001-17;02/10/2010;       Publicidade por materiais impressos;R$ 2.490,00;Não informado; -  -  / 17170 - ERNANI DE PAULA BRAGA - MG - Deputado Estadual;
