Fornecedor;CPF/CNPJ;Data;Tipo Despesa;Valor R$;Forma de Pagamento;Beneficiário/contratante;
GILBERTO SOARES RIBEIRO GARCIA;084.385.596-70;19/08/2010;       Cessão ou Locação de Veículos;R$ 100,00;Cheque; -  -  / 50131 - WALDIR INACIO - MG - Deputado Estadual;
GRAFICA SULMINAS LTDA;64.419.328/0001-20;09/08/2010;       Publicidade por materiais impressos;R$ 395,00;Cheque; -  -  / 50131 - WALDIR INACIO - MG - Deputado Estadual;
LUIZ CESAR FRISON VERONESI;01.757.199/0001-60;30/09/2010;       Publicidade por materiais impressos;R$ 125,00;Cheque; -  -  / 50131 - WALDIR INACIO - MG - Deputado Estadual;
LUIZ CESAR FRISON VERONESI;01.757.199/0001-60;19/08/2010;       Publicidade por placas, estandartes e faixas;R$ 1.134,00;Cheque; -  -  / 50131 - WALDIR INACIO - MG - Deputado Estadual;
MIRIAM REGINA SOARES;342.032.146-53;19/08/2010;Baixa de Recursos Estimáveis em Dinheiro;R$ 200,00;Estimado; -  -  / 50131 - WALDIR INACIO - MG - Deputado Estadual;
M.P.GIL DIVULGASOM;11.326.254/0001-10;22/08/2010;       Publicidade por carros de som;R$ 100,00;Cheque; -  -  / 50131 - WALDIR INACIO - MG - Deputado Estadual;
